<?xml version="1.0" encoding="UTF-8"?>
<definitions xmlns="http://osframework.org/schema/contract-date/definitions"
	xmlns:xsi="http://www.w3.org/2001/XMLSchema-instance"
	xsi:schemaLocation="http://osframework.org/schema/contract-date/definitions org/osframework/contract/date/fincal/config/xml/definitions.xsd">
	<centralBanks>
		<centralBank id="USFR">
			<name>United States Federal Reserve</name>
			<country>US</country>
			<currency>USD</currency>
		</centralBank>
		<centralBank id="BoE">
			<name>Bank of England</name>
			<country>UK</country>
			<currency>GBP</currency>
		</centralBank>
		<centralBank id="SNB">
			<name>Swiss National Bank</name>
			<country>CH</country>
			<currency>CHF</currency>
		</centralBank>
		<centralBank id="ECB">
			<name>European Central Bank</name>
			<country>EU</country>
			<currency>EUR</currency>
		</centralBank>
	</centralBanks>
	<holidays>
		<holiday id="NewYearsDay">
			<name>New Year's Day</name>
			<observance>FIXED</observance>
			<expression>JANUARY/01</expression>
		</holiday>
		<holiday id="StBertholdsDay">
			<name>St. Berthold's Day</name>
			<observance>FIXED</observance>
			<expression>JANUARY/02</expression>
		</holiday>
		<holiday id="MLKDay">
			<name>Martin Luther King Day</name>
			<observance>RELATIVE</observance>
			<expression>JANUARY/MONDAY/3</expression>
		</holiday>
		<holiday id="PresidentsDay">
			<name>Presidents' Day</name>
			<observance>RELATIVE</observance>
			<expression>FEBRUARY/MONDAY/3</expression>
		</holiday>
		<holiday id="GoodFriday">
			<name>Good Friday</name>
			<observance>CALCULATED</observance>
			<expression>EASTER-2</expression>
		</holiday>
		<holiday id="EasterMonday">
			<name>Easter Monday</name>
			<observance>CALCULATED</observance>
			<expression>EASTER+1</expression>
		</holiday>
		<holiday id="LabourDay">
			<name>Labour Day</name>
			<observance>FIXED</observance>
			<expression>MAY/01</expression>
		</holiday>
		<holiday id="EarlyMayBankHoliday">
			<name>Early May Bank Holiday</name>
			<observance>RELATIVE</observance>
			<expression>MAY/MONDAY/1</expression>
		</holiday>
		<holiday id="RobertSchumanDeclaration">
			<name>Anniversay of Robert Schuman's Declaration</name>
			<observance>FIXED</observance>
			<expression>MAY/09</expression>
		</holiday>
		<holiday id="MemorialDay">
			<name>Memorial Day</name>
			<observance>RELATIVE</observance>
			<expression>MAY/MONDAY/L</expression>
		</holiday>
		<holiday id="SpringBankHoliday">
			<name>Spring Bank Holiday</name>
			<observance>RELATIVE</observance>
			<expression>MAY/MONDAY/L</expression>
		</holiday>
		<holiday id="QueensDiamondJubilee">
			<name>The Queen's Diamond Jubilee</name>
			<observance>ONETIME</observance>
			<expression>2012-06-05</expression>
		</holiday>
		<holiday id="AscensionDay">
			<name>Ascension Day</name>
			<observance>CALCULATED</observance>
			<expression>EASTER+39</expression>
		</holiday>
		<holiday id="WhitMonday">
			<name>Whit Monday</name>
			<observance>CALCULATED</observance>
			<expression>EASTER+50</expression>
		</holiday>
		<holiday id="CorpusChristi">
			<name>Corpus Christi</name>
			<observance>CALCULATED</observance>
			<expression>EASTER+60</expression>
		</holiday>
		<holiday id="IndependenceDay">
			<name>Independence Day</name>
			<observance>FIXED</observance>
			<expression>JULY/04</expression>
		</holiday>
		<holiday id="SwissNationalDay">
			<name>Swiss National Day</name>
			<observance>FIXED</observance>
			<expression>AUGUST/01</expression>
		</holiday>
		<holiday id="SummerBankHoliday">
			<name>Summer Bank Holiday</name>
			<description>Summer Bank Holiday (England, Northern Ireland, Wales)</description>
			<observance>RELATIVE</observance>
			<expression>AUGUST/MONDAY/L</expression>
		</holiday>
		<holiday id="LaborDay">
			<name>Labor Day</name>
			<observance>RELATIVE</observance>
			<expression>SEPTEMBER/MONDAY/1</expression>
		</holiday>
		<holiday id="DayOfGermanUnity">
			<name>Day of German Unity</name>
			<observance>FIXED</observance>
			<expression>OCTOBER/03</expression>
		</holiday>
		<holiday id="ColumbusDay">
			<name>Columbus Day</name>
			<observance>RELATIVE</observance>
			<expression>OCTOBER/MONDAY/2</expression>
		</holiday>
		<holiday id="AllSaintsDay">
			<name>All Saints' Day</name>
			<observance>FIXED</observance>
			<expression>NOVEMBER/01</expression>
		</holiday>
		<holiday id="VeteransDay">
			<name>Veterans Day</name>
			<observance>FIXED</observance>
			<expression>NOVEMBER/11</expression>
		</holiday>
		<holiday id="ThanksgivingUS">
			<name>Thanksgiving</name>
			<description>Thanksgiving (US)</description>
			<observance>RELATIVE</observance>
			<expression>NOVEMBER/THURSDAY/4</expression>
		</holiday>
		<holiday id="ChristmasEve">
			<name>Christmas Eve</name>
			<observance>FIXED</observance>
			<expression>DECEMBER/24</expression>
		</holiday>
		<holiday id="Christmas">
			<name>Christmas Day</name>
			<observance>FIXED</observance>
			<expression>DECEMBER/25</expression>
		</holiday>
		<holiday id="BoxingDay">
			<name>Boxing Day</name>
			<observance>FIXED</observance>
			<expression>DECEMBER/26</expression>
		</holiday>
		<holiday id="ChristmasHoliday">
			<name>Christmas Holiday</name>
			<observance>FIXED</observance>
			<expression>DECEMBER/26</expression>
		</holiday>
		<holiday id="StStephansDay">
			<name>St. Stephan's Day</name>
			<observance>FIXED</observance>
			<expression>DECEMBER/26</expression>
		</holiday>
		<holiday id="NewYearsEve">
			<name>New Year's Eve</name>
			<observance>FIXED</observance>
			<expression>DECEMBER/31</expression>
		</holiday>
	</holidays>
	<calendars>
		<calendar id="LnB">
			<description>London bank holidays</description>
			<centralBank refid="BoE" />
			<holidays>
				<holiday refid="NewYearsDay" />
				<holiday refid="GoodFriday" />
				<holiday refid="EasterMonday" />
				<holiday refid="EarlyMayBankHoliday" />
				<holiday refid="SpringBankHoliday" />
				<holiday refid="QueensDiamondJubilee" />
				<holiday refid="SummerBankHoliday" />
				<holiday refid="Christmas" />
				<holiday refid="BoxingDay" />
			</holidays>
		</calendar>
		<calendar id="NCH">
			<description>Swiss Interbank Clearing System holidays</description>
			<centralBank refid="SNB" />
			<holidays>
				<holiday refid="NewYearsDay" />
				<holiday refid="StBertholdsDay" />
				<holiday refid="GoodFriday" />
				<holiday refid="EasterMonday" />
				<holiday refid="LabourDay" />
				<holiday refid="AscensionDay" />
				<holiday refid="WhitMonday" />
				<holiday refid="SwissNationalDay" />
				<holiday refid="Christmas" />
				<holiday refid="StStephansDay" />
			</holidays>
		</calendar>
		<calendar id="NYB">
			<description>New York bank holidays</description>
			<centralBank refid="USFR" />
			<holidays>
				<holiday refid="NewYearsDay" />
				<holiday refid="MLKDay" />
				<holiday refid="PresidentsDay" />
				<holiday refid="MemorialDay" />
				<holiday refid="IndependenceDay" />
				<holiday refid="LaborDay" />
				<holiday refid="ColumbusDay" />
				<holiday refid="VeteransDay" />
				<holiday refid="ThanksgivingUS" />
				<holiday refid="Christmas" />
			</holidays>
		</calendar>
		<calendar id="Tgt">
			<description>TARGET holidays (European Union)</description>
			<centralBank refid="ECB" />
			<holidays>
				<holiday refid="NewYearsDay" />
				<holiday refid="GoodFriday" />
				<holiday refid="EasterMonday" />
				<holiday refid="LabourDay" />
				<holiday refid="RobertSchumanDeclaration" />
				<holiday refid="AscensionDay" />
				<holiday refid="WhitMonday" />
				<holiday refid="CorpusChristi" />
				<holiday refid="DayOfGermanUnity" />
				<holiday refid="AllSaintsDay" />
				<holiday refid="ChristmasEve" />
				<holiday refid="Christmas" />
				<holiday refid="ChristmasHoliday" />
				<holiday refid="NewYearsEve" />
			</holidays>
		</calendar>
	</calendars>
</definitions>
